Name,Equipment,Difficulty,Muscles Worked,Benefits,,,,
Barbell Snatch,Barbell,Advanced,Shoulder Back Arms Legs Core,Increase speed and strength, improve balance, burn calories and build lean mass,,
Clean and Press,Barbell,Advanced,Legs Glute Arms Shoulder Core,Build endurance, strength, and hypertrophy, burn calories while growing lean mass, increase explosiveness
Barbell Front/Back Squat,Barbell,Beginner to Intermediate,Quads Core,Build sturdy legs, improve athletic and weight lifting performance,,,
Barbell Push Press,Barbell,Beginner to Intermediate,Shoulders Legs,Build strength, power, and stability, enhance your ability to do better in sports and weight lifting,
Barbell Hang Clean,Barbell,Beginner,Legs Arms Shoulder,Increase your balance and explosive power, build strength and muscles,,,
Power Clean and Split Jerk,Barbell,Pro,Legs Arms Shoulder Core,Enhance quickness, strength, and balance, burn many calories in quick time and build lean mass,
Barbell Overhead Squat,Barbell,Beginner to Intermediate,Legs and Shoulder,Build lower body strength and mass,,,,
Military Press,Barbell,Beginner,Shoulder,Build sturdy shoulders,,,,
Barbell Bench Press,Barbell,Beginner,Chest,Develop a stronger upper body, especially chest,,,
The Deadlift and its variations,Barbell,Beginner to Advanced,Legs Glute Core and Back,Build endurance, strength, and hypertrophy, improve grip strength, increase power and speed
Barbell Squat Jerk,Barbell,Intermediate to Advanced,Shoulder Legs,Build shoulder mobility and strength, increase lower body strength,,,
Split Jerk,Barbell,Beginner to Intermediate,Shoulder Legs,Develop explosive power and muscular shoulders,,,,
Barbell High Pull,Barbell,Intermediate,Legs Shoulder Back and Arms,Excellent for building upper and lower body strength,,,,
Barbell Rowing,Barbell,Beginner,Back,Strengthen your back muscles and build a wider back,,,,
The Zercher Squat,Barbell,Intermediate,Legs and Forearms,Increase lower body and forearm strength, challenge your strength and endurance,,,
The Split Clean,Barbell,Intermediate to Advanced,Shoulder Legs Core and Arms,Develop strong legs and explosive power,,,,
The Good Morning,Barbell,Intermediate,Hamstrings Lower Back,Build strength and reduce the risk of injury in the lower back, glute, and hamstrings,,
Barbell Jammer,Barbell,Intermediate to Advanced,Quads Hams Calves Glute Shoulder Chest and Triceps,Work on your Full_Body and build mass,,,,
Sumo Deadlift,Barbell,Intermediate,Legs Glute and Back,Build sturdy quads and glute without putting much stress on the lumbar spine, improve grip strength and pulling ability for day-to-day activities,,,
Dumbbell Front-Rack Lunge,Dumbbells,Intermediate,Legs and Glutes,Strengthens lower body and improves mobility,,,,
DB Clean and Press,Dumbbells,Intermediate,Legs and Shoulders,Improves strength, speed, and balance,,
Dumbbell Hang Power Clean,Dumbbells,Intermediate,Legs  Core  and Shoulders,Improves ability to move and act quickly,,,,
Dumbbell Squat,Dumbbells,Beginner,Quads,Builds stronger quads,,,,
DB Push Press,Dumbbells,Beginner,Shoulders and Legs,Enhances strength and speed, and increases shoulder strength and mobility,,,
Dumbbell ManMaker,Dumbbells,Advanced,Full_Body,Engages entire body at once,,,,
Dumbbell Overhead Press,Dumbbells,Beginner,Shoulders,Strengthens shoulders,,,,
DB Romanian Deadlift,Dumbbells,Beginner,Hamstrings Glutes and Lower Back,Strengthens hamstrings and lower back  enhances balance  and decreases risk of injury,,,,
Dumbbell Farmers Carry,Dumbbells,Beginner,Full_Body,Strengthens entire body by simply walking with dumbbells,,,,
Dumbbell Thruster,Dumbbells,Intermediate,Legs and Shoulders,Builds quads and shoulders with one movement,,,,
DB Power Snatch,Dumbbells,Intermediate,Legs Glutes  and Back,Improves quickness and strengthens shoulder,,,,
Dumbbell Power Clean,Dumbbells,Intermediate,Shoulders and Legs,Improves quickness while strengthening shoulder,,,,
Dumbbell Step-Up,Dumbbells,Beginner,Legs Glutes  and Back,Builds stronger legs and increases explosive power,,,,
DB Overhead Squat,Dumbbells,Beginner,Shoulders and Quads,Strengthens shoulders and quads,,,,
Dumbbell Turkish Get-Up,Dumbbells,Intermediate,Full_Body,Strengthens Full_Body, improves posture, and increases shoulder stability,,
DB Pushup to Renegade Row,Dumbbells,Advanced,Upper Body,Builds muscular strength and improves balance and stabilization,,,,
Dumbbell Russian Twist,Dumbbells,Intermediate,Legs Glutes  and Back,Builds sturdy core and improves balance,,,,
Dumbbell Deadlift,Dumbbells,Beginner,Full_Body,Strengthens entire body,,,,
Dumbbell Surrenders,Dumbbells,Intermediate,Full_Body,Strengthens entire body,,,,
Dumbbell Lunges to Hammer Curl,Dumbbells,Intermediate,Legs and Biceps,Builds legs and biceps.,,,,
Turkish Get-up, Kettlebell, Advanced, Full_Body, N/A,,,,
Russian Kettlebell Swing, Kettlebell, Beginner, Shoulders Legs, N/A, N/A,,,
American Kettlebell Swing, Kettlebell, Beginner to Intermediate, Full_Body, N/A,,,,
The Kettlebell Snatch, Kettlebell, Intermediate, Full_Body, N/A,,,,
Kettlebell Good Morning, Kettlebell, Beginner, Hamstring, Lower Back, N/A,,,
Single-Leg Romanian Deadlift, Kettlebell, Intermediate, Hamstring, Lower Back, Improves strength and balance,,,
Kettlebell Gorilla Row, Kettlebell, Beginner to Intermediate, Back, Builds a muscular back,,,,
Kettlebell Thrusters, Kettlebell, Beginner to Intermediate, Full_Body, N/A,,,,
KB Goblet Squats, Kettlebell, Beginner to Intermediate, Quadriceps, Glute, Targets the side muscles of your thighs to build defined legs,,,
Kettlebell Front Raise, Kettlebell, Beginner, Shoulders, Reinforces the front part of shoulders more specifically,,,,
Kettlebell Taters, Kettlebell, Intermediate, Full_Body, Helps build strong quads and improve balance,,,,
KB Farmers Carry, Kettlebell, Beginner, Full_Body, N/A,,,,
Kettlebell Windmill, Kettlebell, Intermediate, Full_Body, N/A,,,,
Kettlebell Deadlift and its Variations, Kettlebell, Beginner to Advanced, Full_Body,,,,,
RingPush-Up,Rings,Advanced,Full-Body,Improving balance and flexibility boost your muscular strength, and improve your body shape,,,
ForwardRolltoSupport, Rings, Advanced, Full-Body, Improving balance and flexibility boost your muscular strength, and improve your body shape,,,
SkintheCat, Rings,Advanced,Full-Body,Improving balance and flexibility boost your muscular strength, and improve your body shape,,,
L-SitonRings, Rings,Advanced,Full-Body,Improving balance and flexibility boost your muscular strength, and improve your body shape,,,
RingHandstandPushUp, Rings,Challenging,Full-Body,Improving balance and flexibility boost your muscular strength, and improve your body shape,,,
StrictToes-to-Rings, Rings,Challenging,Full-Body,Improving balance and flexibility boost your muscular strength, and improve your body shape,,,
RingDips,Rings,Advanced,Full-Body,Improving balance and flexibility boost your muscular strength, and improve your body shape,,,
RingRow,Rings,Advanced,Full-Body,Improving balance and flexibility boost your muscular strength, and improve your body shape,,,
Pull-Up,Pull-Up Bar,Intermediate,Back and Biceps,Builds a sturdy upper body, improves balance, strength, and body posture,
Hanging Windshield Wiper,Pull-Up Bar,Advanced,Core,Improves core strength and stability,,,,
Butterfly Pull-Up,Pull-Up Bar,Intermediate,Back and Biceps,Strengthens the upper body and improves grip strength,,,,
L-Sit on Bar,Pull-Up Bar,Intermediate,Core and Biceps,Improves core and upper body strength and stability,,,,
Toes-to-Bar,Pull-Up Bar,Advanced,Core,Targets the core muscles and improves grip strength,,,,
Chest-to-Bar Pull-Ups,Pull-Up Bar,Advanced,Core,Targets the core and upper body muscles and improves grip strength,,,,
Pull-Up Bar Muscle Up,Pull-Up Bar,Advanced,Full_Body,Improves overall body strength, coordination, and mobility,,
Pull-Up Bar Knees-to-Elbows,Pull-Up Bar,Advanced,Core,Back, and Shoulders,Targets the core, back, and shoulder muscles and improves grip strength
Negative Pull-Ups,Pull-Up Bar,Beginner,Back,Strengthens the back muscles and helps to scale up for more advanced variations,,,,
Chin-Ups,Pull-Up Bar,Beginner,Biceps,Improves upper body strength and helps to scale up for more advanced variations,,,,
Handstand Push-up,Bodyweight,Advanced,Shoulder, Arms, and Core,Develops shoulder strength, overall stability, and balance
Box Jumps,Bodyweight, Beginner,Full_Body,Strengthens lower body and improves quick pace ability,,,,
Burpee and its variations,Bodyweight, Intermediate,Full_Body,High-intense movement that builds up the entire body, burns many calories, and improves explosiveness,,
Pistol Squat,Bodyweight,Intermediate,Legs,Improves strength and mobility,,,,
Handstand Walk,Bodyweight,Advanced,Upper Body, Builds stability, balance and engages the Full_Body,,,
Squat Thrust,Bodyweight,Beginner,Full_Body,Works on the entire body and enhances endurance,,,,
The Double-Under,Bodyweight,Intermediate,Full_Body,High-intensity workout that burns plenty of calories in a short time and builds stamina,,,,
Floor L-Sit,Bodyweight,Intermediate,Arms and Core,Improves balance and strength and forges core,,,,
Box Step-Up,Bodyweight,Beginner,Lower Body,Strengthens lower body and improves balance and overall performance,,,,
Squat and its variations,Bodyweight,Beginner,Full_Body,Strengthens lower body, builds muscles, and improves balance and overall performance,,
Plank and its variations,Bodyweight,Intermediate,Lower Body,Fortifies core, increases endurance, and tones abdominal muscles,,
Mountain Climbers,Bodyweight,Beginner,Core,High-intensity core workout that helps you build a sturdy core and burn plenty of calories in a quick time,,,,
Tuck ups,Bodyweight,Intermediate,Core,Incorporate it into your core workout routine to strengthen your abs and oblique,,,,
Leg Raises/Lifts,Bodyweight,Beginner,Core,Helps you develop a sturdy core,,,,
Dragon Fly,Bodyweight,Advanced,Core,One of the best and most effective abs workouts you can do to build six-pack abs. Moreover, it improves your ability to control your body movement,,,
Bear Crawl,Bodyweight,Beginner,Full_Body,Engages your entire body and boosts stamina,,,,
Knee to opposite Elbow Mountain Climber,Bodyweight,Intermediate,Core,,,,,
V ups,Bodyweight,Intermediate,Core,Helps you forge core and build defined abs,,,,
Squat Jump,Bodyweight,Beginner,Full_Body,Increases explosive power, boosts stamina, and burns many calories,,
Hollow Rocks,Bodyweight,Beginner,Core,Strengthens and tones your abdominal muscles.,,,,
Dumbbell Front-Rack Lunge,Dumbbells,Intermediate,Legs and Glutes,Strengthens lower body and improves mobility,,,,
DB Clean and Press,Dumbbells,Intermediate,Legs and Shoulders,Improves strength, speed, and balance,,
TheWallBall,WallBall,Beginner,Full_Body,The wall ball is an excellent workout for developing strength and endurance.,,,,
RopeClimbing,Rope,Intermediate,Full_Body,Rope climbing is excellent for developing a solid grip, upper body strength, and the ability to move fast.,,
L-SittoShoulderStand, N/A,Advanced,Full_Body,It is one of the most sophisticated workouts to improve balance, strength, and flexibility.,,
BarDips,Barbell,Intermediate,Upper Body,The dips strengthen the chest and triceps and help you build a strong body.,,,,
BarLSit,Barbell,Intermediate,Core,,,,,
Running,Outside,Beginner,Full_Body,Running is a great way to build endurance, burn plenty of calories, and lose weight. You can also check out basic but crucial tips for improving longer and faster.,,
Sprinting,Outside,Intermediate,Full_Body,It is an anaerobic workout, helps you utilize your stored fats during the movement, and increases weight loss.,,
RowingMachine,Machine,Intermediate,Full_Body,The rowing machine exercise improves the back strength, flexibility in the upper body, boosts stamina, burns many calories, and decreases fat mass and Full_Body fat percent.
